{
  "composition": "bench07/operator",
  "title": "Bench 07 · operator",
  "shell": "^2.3",
  "role": "user",
  "plugins": [
    "charts"
  ],
  "components": [
    {
      "from": "consul",
      "service": "session-service"
    },
    {
      "from": "consul",
      "service": "testflow-execution"
    },
    {
      "from": "consul",
      "service": "testbench-climate-chamber-sim"
    },
    {
      "from": "consul",
      "service": "testbench-device-psu"
    },
    {
      "from": "consul",
      "service": "signal-discovery"
    }
  ],
  "order": [
    "session.header",
    "*"
  ]
}
