{
  "composition": "bench07-signals/dev",
  "title": "Bench 07 · signals",
  "shell": "^2.3",
  "role": "dev",
  "plugins": [
    "charts",
    "graph-studio"
  ],
  "components": [
    {
      "from": "consul",
      "service": "session-service"
    },
    {
      "from": "consul",
      "service": "signal-graph-signal-in"
    },
    {
      "from": "consul",
      "service": "signal-discovery"
    },
    {
      "from": "consul",
      "service": "testbench-climate-chamber-sim"
    }
  ]
}
